{
  "schema_version": "1.0.2",
  "config_version": 1,
  "system": {
    "hostname": "mitranet-edge",
    "domain": "internal.lan",
    "timezone": "Asia/Jakarta",
    "timeservers": [
      "pool.ntp.org",
      "time.google.com"
    ],
    "dns_servers": [
      "1.1.1.1",
      "8.8.8.8"
    ]
  },
  "interfaces": {
    "wan": {
      "device": "eth0",
      "description": "WAN Uplink",
      "enabled": true,
      "role": "wan",
      "type": "ethernet",
      "mtu": 1500,
      "mac": null,
      "ipv4": {
        "mode": "dhcp",
        "address": null,
        "prefix": null,
        "gateway": null
      },
      "ipv6": {
        "mode": "disabled",
        "address": null,
        "prefix": null,
        "gateway": null
      }
    },
    "lan": {
      "device": "eth1",
      "description": "Primary LAN",
      "enabled": true,
      "role": "lan",
      "type": "ethernet",
      "mtu": 1500,
      "mac": null,
      "ipv4": {
        "mode": "static",
        "address": "192.168.1.1",
        "prefix": 24,
        "gateway": null
      },
      "ipv6": {
        "mode": "disabled",
        "address": null,
        "prefix": null,
        "gateway": null
      }
    }
  },
  "vlans": {},
  "bridges": {},
  "bonds": {},
  "vrfs": {},
  "routing": {
    "static_routes": [],
    "gateways": {}
  },
  "firewall": {
    "aliases": {},
    "rules": []
  },
  "nat": {
    "outbound": [],
    "port_forward": []
  },
  "dhcp": {},
  "dns": {
    "enabled": true,
    "dnssec": true,
    "host_overrides": {},
    "upstream_forwarders": [
      "1.1.1.1",
      "8.8.8.8"
    ]
  },
  "vpn": {
    "wireguard": {},
    "ipsec": {},
    "openvpn": {}
  },
  "qos": {},
  "ha": {},
  "services": {},
  "users": {},
  "certificates": {}
}
